dish,angle,mood,cta,season,photo
French Toast with Lemon Blueberry Ice Cream,indulgent warm against cold unexpected combination,seductive,substack,Summer,photo-library/french-toast/hero.jpg
Cacio e Pepe,Roman classic three ingredients technique is everything,confident,substack,Summer,photo-library/cacio-e-pepe/hero.jpg
Filet Mignon with a Mustard forward Black Pepper Sauce,the better the quality the better the result,seductive,substack,Summer,photo-library/filet-mignon/hero.jpg
Tuscan Inspired Tortellini,not my usual approach to sauces but it worked,inspired,substack,Summer,photo-library/tuscan-tortellini/hero.jpg
Rigatoni al Ragù,slow cooked four hours patience is the ingredient,confident,substack,Summer,photo-library/rigatoni-ragu/hero.jpg
